{
    "@context": "https://standards-ontotest.oftrust.net/v2/Context/Identity/Element/BuildingElement/Storey/",
    "@type": "Storey",
    "@id": "",
    "data": {
        "thickness": "",
        "volume": "",
        "idLocal": "",
        "weight": "",
        "areaNet": "",
        "categorizationLocal": "",
        "name": "",
        "url": "",
        "ifcGuid": "",
        "width": "",
        "length": "",
        "height": "",
        "ifcElementType": "",
        "status": "",
        "additionalInformation": "Our laminated logs are glued from two or more planed blanks in a way that the heartwood will stay on the logs surface. This is done to ensure that cracking and bending stay minimal.",
        "areaGross": "",
        "descriptionGeneral": "",
        "ifcElementName": "",
        "colorName": "",
        "colorCode": "",
        "sizeAreaLivingAudited": ""
    },
    "metadata": {
        "updatedBy": "",
        "createdBy": "",
        "createdAt": "",
        "updatedAt": ""
    }
}